[
  {
    "R": 241.64,
    "opis": "Wykucie otworów w ścianach z cegieł dla otworów drzwiowych i okiennych, zaprawa wapienna lub cementowo-wapienna, grubość ponad 1/2 cegły - powiększenie otworów okiennych i drzwiowych",
    "S": 0,
    "jm": "m3",
    "suma": 241.64,
    "M": 0,
    "knr": "KNR 4-01 0329-3"
  },
  {
    "R": 7.56,
    "opis": "Sprawdzenie samoczynnego wyłączania zasilania (następna próba)",
    "S": 0,
    "jm": "prób.",
    "suma": 7.56,
    "M": 0,
    "knr": "KNNR 5 1305-02"
  },
  {
    "R": 2.03,
    "opis": "Zagęszczenie gruntu ubijakami mechanicznymi; grunty sypkie kat. I-III",
    "S": 7.12,
    "jm": "m3",
    "suma": 10.17,
    "M": 1.02,
    "knr": "KNR 2-01 0236-01"
  },
  {
    "knr": "KNR 2-31 0101-01",
    "opis": "0101-02 Mechaniczne wykonanie koryta na całej szerokości jezdni i chodników w gruncie kat. I-IV głębokości 58 cm",
    "jm": "m2",
    "R": 1.21,
    "M": 2.94,
    "S": 0,
    "suma": 4.15
  },
  {
    "R": 68.4,
    "opis": "Przygotowanie podłoża do zabudowania rozdzielnic - kucie ręczne pod śruby kotwowe w podłożu z betonu - 3-4 otwory mocujące.",
    "S": 0,
    "jm": "aparat",
    "suma": 80.4,
    "M": 12,
    "knr": "KNR-W 5-08 0401-06"
  },
  {
    "knr": "KNR 2-31 0104-05",
    "opis": "Warstwy odsączające z piasku w korycie lub na całej szerokości drogi, wykonanie ręczne, zagęszczanie mechaniczne - grubość warstwy po zagęszczeniu 10 cm",
    "jm": "m2",
    "R": 4.96,
    "M": 4.26,
    "S": 0.88,
    "suma": 10.09
  },
  {
    "knr": "KNR 0-19 1023-12",
    "opis": "Montaż drzwi aluminiowych przeszklonych z obróbką obsadzenia, dwuskrzydłowych zewnętrznych",
    "jm": "m2",
    "R": 131.95,
    "M": 2292.64,
    "S": 3.41,
    "suma": 2428.01
  },
  {
    "R": 4.17,
    "opis": "Rowki pod krawężniki i ławy krawężnikowe, 20x20 cm, grunt kategorii III-IV",
    "S": 0,
    "jm": "m",
    "suma": 4.17,
    "M": 0,
    "knr": "KNR 2-31 0401-2"
  },
  {
    "R": 1.48,
    "opis": "(z.VII) Gruntowanie podłoży - powierzchnie pionowe",
    "S": 0.49,
    "jm": "m2",
    "suma": 9.870000000000001,
    "M": 7.9,
    "knr": "NNRNKB 202 1134-02"
  },
  {
    "R": 160.16,
    "opis": "Złącza kablowe typu ZK4a 400 A + !P",
    "S": 0,
    "jm": "kpl.",
    "suma": 4290.16,
    "M": 4130,
    "knr": "KNNR 5 0401-02"
  },
  {
    "R": 103.8,
    "opis": "Mechaniczna rozbiórka nawierzchni betonowej w jezdni drogowej",
    "S": 22.162,
    "jm": "m3",
    "suma": 125.96199999999999,
    "M": 0,
    "knr": "KNK 2-06 0806-01"
  },
  {
    "R": 75.81,
    "opis": "Parapety zewnętrzne z blachy tyta-cynk",
    "S": 0.3,
    "jm": "m2",
    "suma": 144.76100000000002,
    "M": 68.651,
    "knr": "KNR 2-02 0507-03"
  },
  {
    "R": 360.6,
    "opis": "Ręczna rozbiórka nawierzchni betonowej",
    "S": 0,
    "jm": "m3",
    "suma": 360.6,
    "M": 0,
    "knr": "KNK 2-06 0806-02"
  },
  {
    "R": 109.5,
    "opis": "Kopanie rowów dla kabli w sposób ręczny w gruncie kat. IV",
    "S": 0,
    "jm": "m3",
    "suma": 109.5,
    "M": 0,
    "knr": "KNNR 5 0701-03"
  },
  {
    "R": 7.82,
    "opis": "Montaż certyfikowanych uchwytów pod przewody kabelkowe UDF 10 E90 układane pojedynczo z przygotowaniem podłoża mechanicznie - przykręcanie do kotw metalowych E90 w podłożu betonowym",
    "S": 0,
    "jm": "m",
    "suma": 15.65,
    "M": 7.83,
    "knr": "KNR 5-08 0201-03"
  },
  {
    "R": 0,
    "opis": "Montaż przewodów uziemiających i wyrównawczych głównych i lokalnych",
    "S": 0,
    "jm": "m",
    "suma": 0.204,
    "M": 0.204,
    "knr": "KNNR 5 0602-04"
  },
  {
    "R": 18.69,
    "opis": "Licowanie ścian płytkami - na klej",
    "S": 6.23,
    "jm": "m2",
    "suma": 124.58,
    "M": 99.66,
    "knr": "KNR 0-12 0829-03"
  },
  {
    "knr": "KNR 2-02 0406-03",
    "opis": "Belki długości ponad 3 m - przekrój poprzeczny drewna do 180 cm2 z tarcicy nasyconej",
    "jm": "m3",
    "R": 592.16,
    "M": 3158.21,
    "S": 197.39,
    "suma": 3947.76
  },
  {
    "R": 218.1,
    "opis": "Rozebranie ścian, filarów i kolumn z cegieł na zaprawie cementowo-wapiennej",
    "S": 0,
    "jm": "m3",
    "suma": 218.1,
    "M": 0,
    "knr": "KNR 4-01 0349-02"
  },
  {
    "knr": "KNR 2-02 0409-04",
    "opis": "Wymiany i rozpory, przekrój poprzeczny drewna do 180 cm2 z tarcicy nasyconej",
    "jm": "m3",
    "R": 704.23,
    "M": 3755.91,
    "S": 234.74,
    "suma": 4694.88
  },
  {
    "knr": "KNR-W 5-08 0303-20",
    "opis": "Montaż na gotowym podłożu skrzynek kontrolnych do elewacji (nr kat. 68.2). p.analogię",
    "jm": "szt.",
    "R": 14.88,
    "M": 46.13,
    "S": 0.0,
    "suma": 61.01
  },
  {
    "R": 0,
    "opis": "Przygotowanie i montaż zbrojenia t",
    "S": 0,
    "jm": "kg",
    "suma": 316.09,
    "M": 316.09,
    "knr": "KNR 2-02 1101-"
  },
  {
    "R": 36.4,
    "opis": "Sprawdzenie i pomiar 1-fazowego obwodu elektrycznego niskiego napięcia",
    "S": 0,
    "jm": "pomiar",
    "suma": 36.4,
    "M": 0,
    "knr": "KNNR 5 1301-01"
  },
  {
    "R": 381.07,
    "opis": "Murłaty - przekrój poprzeczny drewna ponad 180 cm2 z tarcicy nasyconej",
    "S": 127.02,
    "jm": "m3",
    "suma": 2540.45,
    "M": 2032.36,
    "knr": "KNR 2-02 0406-02"
  },
  {
    "R": 3.08,
    "opis": "Układanie rur ochronnych DVK 75 w wykopie",
    "S": 0.1,
    "jm": "m",
    "suma": 14.26,
    "M": 11.08,
    "knr": "KNR 5-10 0303-01"
  },
  {
    "R": 0.85,
    "opis": "Ocieplenie ścian budynków płytami z wełny mineralnej - przymocowanie płyt za pomocą łączników metalowych",
    "S": 0.28,
    "jm": "szt.",
    "suma": 5.67,
    "M": 4.54,
    "knr": "KNR 0-23 2613-03"
  },
  {
    "knr": "KNR 2-02 0801-4",
    "opis": "Tynki zwykłe wykonane mechanicznie, stropy i podciągi, kategoria·III, budynki do 8 kondygnacji",
    "jm": "m2",
    "R": 13.49,
    "M": 5.16,
    "S": 1.61,
    "suma": 20.26
  },
  {
    "R": 1088.48,
    "opis": "Słupy żelbetowe, prostokątne o wysokości do 4 m - z zastosowaniem pompy do betonu",
    "S": 311,
    "jm": "m3",
    "suma": 3109.95,
    "M": 1710.47,
    "knr": "KNR 2-02 0208-05"
  },
  {
    "R": 18.63,
    "opis": "Ocieplenie ścian budynków płytami styropianowymi - przyklejenie warstwy siatki na ścianach",
    "S": 5.32,
    "jm": "m2",
    "suma": 53.23,
    "M": 29.28,
    "knr": "KNR 0-23 2612-06"
  },
  {
    "R": 1.26,
    "opis": "Zaprawianie bruzd o szer. do 50 mm",
    "S": 0,
    "jm": "m",
    "suma": 1.26,
    "M": 0,
    "knr": "KNR 4-03 1012-02"
  },
  {
    "R": 5,
    "opis": "Krawężniki betonowe, dodatek za ustawienie krawężników na łukach o promieniu do 40·m",
    "S": 0,
    "jm": "m",
    "suma": 5,
    "M": 0,
    "knr": "KNR 2-31 0403-8"
  },
  {
    "R": 0.43,
    "opis": "Nasypanie warstwy piasku grub. 0.1 m na dno rowu kablowego o szer.do 0.6 m",
    "S": 0.11,
    "jm": "m",
    "suma": 1.7,
    "M": 1.16,
    "knr": "KNR 5-10 0301-02"
  },
  {
    "knr": "KNR 0-35 0134-",
    "opis": "Połączenie instalacji w.z. z istniejącą wewnętrzną instalacją wodociągową szt. d",
    "jm": "m2",
    "R": 0.0,
    "M": 2.61,
    "S": 0.0,
    "suma": 2.61
  },
  {
    "knr": "KNR 2-31 0403-03",
    "opis": "Krawężniki betonowe wystające o wymiarach 15x30 cm na podsypce cementowo-piaskowej",
    "jm": "m",
    "R": 12.87,
    "M": 24.84,
    "S": 0.0,
    "suma": 37.71
  },
  {
    "R": 1.92,
    "opis": "Mechaniczne wykucie bruzd dla przewodów wtynkowych w cegle",
    "S": 0,
    "jm": "m",
    "suma": 1.92,
    "M": 0,
    "knr": "KNR-W 4-03 1001-01"
  },
  {
    "R": 102.22,
    "opis": "Podkłady betonowe na podłożu gruntowym",
    "S": 34.07,
    "jm": "m3",
    "suma": 681.46,
    "M": 545.17,
    "knr": "KNR 2-02 1101-01"
  },
  {
    "knr": "KNNR 5 0203-01",
    "opis": "Przewody telekomunikacyjny   wciągane do rur",
    "jm": "m",
    "R": 0.99,
    "M": 4.17,
    "S": 0.0,
    "suma": 5.15
  },
  {
    "R": 14.77,
    "opis": "Wyprawa elewacyjna cienkowarstwowa z akrylowych tynków dekoracyjnych wykonana ręcznie",
    "S": 4.22,
    "jm": "m2",
    "suma": 42.19,
    "M": 23.2,
    "knr": "KNR 0-23 0933-02"
  },
  {
    "R": 6.55,
    "opis": "Montaż do gotowego podłoża gniazd wtyczkowych podtynkowych 2-biegunowych z uziemieniem 16A/2.5 mm2 pojedynczych",
    "S": 0,
    "jm": "szt.",
    "suma": 21.19,
    "M": 14.64,
    "knr": "KNR-W 5-08 0309-02"
  },
  {
    "R": 36.12,
    "opis": "Okładziny ścian z wykładzin z tworzyw sztucznych, rulonowe heterogeniczne klejone",
    "S": 0.6,
    "jm": "m2",
    "suma": 206.74,
    "M": 170.02,
    "knr": "KNR 19-01 0907-5"
  },
  {
    "knr": "KNR 2-21 0218-03",
    "opis": "Rozścielenie ziemi urodzajnej spycharkami na terenie płaskim",
    "jm": "m3",
    "R": 9.46,
    "M": 10.0,
    "S": 0,
    "suma": 19.46
  },
  {
    "knr": "KNR 2-31 0403-3",
    "opis": "Krawężniki betonowe, wystające 15x30·cm na podsypce cementowo-piaskowej",
    "jm": "m",
    "R": 12.02,
    "M": 41.25,
    "S": 0.0,
    "suma": 53.27
  },
  {
    "R": 11.55,
    "opis": "Rozebranie nawierzchni z płyt drogowych betonowych, z wypełnieniem spoin zaprawą cementową, grubość płyt 15·cm",
    "S": 0,
    "jm": "m2",
    "suma": 11.55,
    "M": 0,
    "knr": "KNR 2-31 0811-4"
  },
  {
    "R": 10.8,
    "opis": "Ława pod krawężniki - dodatek za wykonanie ławy betonowej na łukach o promieniu do 40 m",
    "S": 0,
    "jm": "m3",
    "suma": 10.8,
    "M": 0,
    "knr": "KNR 2-31 0402-05"
  },
  {
    "R": 36.12,
    "opis": "Uzupełnienie tynków zwykłych wewnętrznych kat. III, (ściany płaskie, słupy prostokątne, z cegły, pustaków ceramicznych, gazo- i pianobetonu) zaprawa cem-wap - uzupełnienia tynków po odbiciu",
    "S": 0.78,